Publish,Lopinavir/ritonavir,Several large trials indicate that the antiviral agent lopinavir alone or in combination with ritonavir among patients with COVID-19 is an ineffective therapy. All major guidelines currently recommend against the use of lopinavir/ritonavir as treatment for COVID-19.,Repurposed Antiviral Drugs for Covid-19 (NEJM Dec 2020),https://www.nejm.org/doi/full/10.1056/NEJMoa2023184,,,,,,,,,,,,,https://www.nejm.org/doi/full/10.1056/NEJMoa2001282,A,https://airtable.com/shrotaa0TOXrHFFsk/tbl2bwt3ywyTqJUlA?filter_Topic=Lopinavir%2FRitonavir,COVID19 Therapeutics,,,Don't,https://www.bmj.com/content/370/bmj.m3379,,"January 13, 2023: WHO strongly recommends against lopinavir/ritonavir for treatment of COVID-19 of any severity due to no impact on mortality or need for mechanical ventilation. ",,No recommendation,,,,No recommendation,No recommendation,,,,"Última actualización, enero de 2021: Sin recomendación",No recommendation,,Last updated January 28 2021,Don't,https:https://www.covid19treatmentguidelines.nih.gov/antiviral-therapy/lopinavir-ritonavir-and-other-hiv-protease-inhibitors/,,,2/11/2021,Don't,https://www.idsociety.org/practice-guideline/covid-19-guideline-treatment-and-management/#toc-6,,,"Feb 8, 2023: The guideline panel recommends against treatment with lopinavir/ritonavir across patient groups at risk for or with COVID-19.",Don't unless clinical trial,https://infectioncontrol.ucsfmedicalcenter.org/sites/g/files/tkssra4681/f/Executive_Summary_UCSF_Adult_COVID_Inpatient_Management_Guidelines.pdf,,,9/8/2021,Don't,https://bwh.covidprotocols.org/protocols/therapeutics/#lopinavir-ritonavir,,,11/15/2020,Don't,https://www.nicd.ac.za/wp-content/uploads/2020/08/5-Drug-therapy-003.pdf,"Last updated Aug 1, 2020. Chloroquine or hydroxychloroquine are not recommended due to evidence of futility in large randomized trials. ",Anzics don't https://covid19evidence.net.au/#living-guidelines,No recommendation,https://www.apollohospitals.com/apollo_pdf/Final-Redbook-External-circulation.pdf,4/2021. Lopinavir/ritonavir are not included in the treatment algorithm for patients hospitalized with COVID-19. ,Don't,,,,1/5/2023: AIIMS does not recommend the use of Lopinavir/ritonavir for the treatment of COVID-19.,,Don't unless clinical trial,https://covidprotocols.org/chapters/treatments/#other-antivirals-f7coj2uqwqu7,11/15/2020,,,,,,,,,No recommendation,https://www.apollohospitals.com/apollo_pdf/Final-Redbook-External-circulation.pdf,4/2021. Lopinavir/ritonavir are not included in the treatment algorithm for patients hospitalized with COVID-19. ,
Publish,"Baricitinib 
(JAK inhibitor)","Many guideline authorities recommend the use of the antiinflammatory JAK-2 inhibitor baricitinib in addition to steroids in patients who are admitted to the hospital with severe to critical COVID pneumonia and have increasing oxygen requirements or other evidence of widespread inflammation. Most institutions recommend 4mg PO daily for up to 14 days, with dose-adjustment based on renal function. IL-6 inhibitors like tocilizumab or sarilumab may be used as an alternative to baricitinib; most institutions do not recommend one agent over another due to lack of data directly comparing them, but some instutitions, like UCSF, favor a particular medication as first line (baricitinib, in the case of UCSF). Baricitinib and IL-6 inhibitors should not be used concurrently. Some data additionally support baricitinib in place of steroids if there is a strong contraindication to the use of steroids (such cases are rare). Some institutions specify that tocilizumab should be used in place of baricitinib in patients receiving invasive mechanical ventilation. See institution guideline links for details. ",Baricitinib in hospitalised patients with COVID-19: A meta-analysis of randomised controlled trials (Lancet June 2022),https://www.thelancet.com/journals/eclinm/article/PIIS2589-5370(22)00219-X/fulltext,"Efficacy and safety of baricitinib for the treatment of hospitalised adults with COVID-19 (COV-BARRIER): a randomised, double-blind, parallel-group, placebo-controlled phase 3 trial (Lancet Resp Med 2021)",https://www.thelancet.com/journals/lanres/article/PIIS2213-2600(21)00331-3/fulltext,Articles & Tutorials,Baricitinib plus Remdesivir for Hospitalized Adults with Covid-19 (NEJM Dec 2020),https://www.nejm.org/doi/full/10.1056/NEJMoa2031994,Articles & Tutorials,Patient Selection and Dosing,https://covidprotocols.org/en/chapters/treatments/#dosing-ttfesvkw6tr2,URL,,,,,A,https://airtable.com/shrotaa0TOXrHFFsk/tbl2bwt3ywyTqJUlA?filter_Topic=Baricitinib,COVID19 Therapeutics,,,Do,https://www.bmj.com/content/370/bmj.m3379,,"1/13/22. WHO makes a strong recommendation for use of baricitinib in addition to corticosteroids in patients with severe or critical COVID-19, including those requiring mechanical ventilation. Baricitinib (or IL-6 inhibitors) should be used with systemic steroids. Additional data from RECOVERY showed combinng corticosteroids, IL-6 receptor inhibitors and baricitinib provided incremental safety benefit and can be administered jointly. However, clinicians may opt for less agressive immunosuppressive therapy and/or combine medications in a stepwise fashion in patients who are deteoriating. WHO does recommend baricitinib over IL-6 inhibitors or vice-versa, and instead suggests that selection of one agent or another may depend on experience and comfort using the drugs; local institutional policies; route of administration (baricitinib is oral; IL-6 receptor blockers are intravenous); and cost. Additionally, clinical trials were not representative of the global population and risk benefit may be less advantageous, particularly in areas where certain infectious diseases such as HIV, TB, and certain fungal infections are endemic or in patients with increased risk of opportunistic infections. ",,No recommendation,,,,No recommendation,No recommendation,,,,No recommendation,No recommendation,,No recommendation,Do,https://www.covid19treatmentguidelines.nih.gov/therapies/immunomodulators/kinase-inhibitors/,,,"Last updated 8/8/22. For patients admitted to the hospital with severe or critical COVID-19, and who have rapidly increasing oxygen needs and have increased markers of inflammation, the NIH recommends the use of baricitinib or tocilizumab in addition to systemic corticosteroids. For patients on ECMO or mechanical ventilation, tocilizumab or baricitinib should be givein in addition to systemic corticosteroids. Baricitinib should not be used at the same time as an IL-6 inhibitor. ",Do,https://www.idsociety.org/practice-guideline/covid-19-guideline-treatment-and-management/,,,"Feb 8, 2023: Among hospitalized adults with severe COVID-19, the IDSA suggests baricitinib with corticosteroids rather than no baricitinib. The IDSA also recommends baricitinib plus remdesivir as an alternative for corticosteroids among hospitalized patients with severe COVID-19 who cannot receive a corticosteroid (which is standard of care) because of a strong contraindication. ""Severe"" in this context refers to patients with SpO2 ≤ 94% on room air, including patients on suppoemental oxygen, oxygen through a high-flow device, or non-invasive ventilation. Despite not including patients on ECMO or mechanical ventilation as a part of this definition or recommendation, IDSA notes that ""limited additional data suggest a mortality reduction even among patients requiring mechanical ventilation.""",Do,https://infectioncontrol.ucsfmedicalcenter.org/sites/g/files/tkssra4681/f/Executive_Summary_UCSF_Adult_COVID_Inpatient_Management_Guidelines.pdf,,,"12/28/21. UCSF recommends baricitinib in addition to steroids in patients with severe or critical disease who have escalating oxygen requirements via nasal cannula oxygen, or currently require HFNC or non-invasive mechanical ventilation. Baricitinib may be used in place of steroids if patients meet criteria for systemic steroid use but have a strong contraindication to the use of steroids. Tocilizumab should be used in place of baricitinib with rapidly escalating respiratory failure in which mechanical ventilation is considered imminent, or if a patient is already receiving invasive mechanical ventilation. UCSF notes that IL-6 inhibitors and baricitinib should NOT be used concurrently, one should not replace the other if a dose or course has already already been given.",Do,https://covidprotocols.herokuapp.com/pdf/Immunomodulator%20Algorithm%20in%20COVID-19.pdf,,,12/22/21. BWH recommends either baricitinib or tocilizumab in addition to systemic coritcosteroids for patients with severe to critical COVID who have critical or rapidly progressing respiratory failure. These medications should only be given within 4 days of hospital admission for respiratory failure or onset of respiratory failure if already hospitalized for a separate issue. Tocilizumab should only be given if CRP ≥75; there is no such requirement for baricitinib. See link for details. ,No recommendation,,,BWH this is in process,Inconclusive ,https://www.apollohospitals.com/apollo_pdf/Final-Redbook-External-circulation.pdf,"4/2021. Baricitinib, in combination with remdesivir, may be considered in cases when corticosteroids may not be used. ",No recommendation,,,, ,,No recommendation,,,,,,,,,,,Inconclusive ,https://www.apollohospitals.com/apollo_pdf/Final-Redbook-External-circulation.pdf,"4/2021. Baricitinib, in combination with remdesivir, may be considered in cases when corticosteroids may not be used. ",
Publish,ACE inhibitor - As treatment for COVID-19,There are inadequate data to inform guidelines on the initiation of ACE inhibitor (ACEi) or Angiotensin Receptor Blocker (ARB) specifically as therapy for COVID-19 among hospitalized patients. ,"
Efficacy of Losartan in Hospitalized Patients With COVID-19–Induced Lung Injury A Randomized Clinical Trial (JAMA Netw Open, Mar 2022)",https://jamanetwork.com/journals/jamanetworkopen/fullarticle/2790162,,,,,,,,,,,,,,C,https://airtable.com/shrotaa0TOXrHFFsk/tbl2bwt3ywyTqJUlA?filter_Topic=RAAS%20Inhibitors,COVID19 Therapeutics,,,No recommendation,,,,,No recommendation,,,,No recommendation,No recommendation,,,,No recommendation,No recommendation,,No recommendation,Don't unless clinical trial,https://www.covid19treatmentguidelines.nih.gov/concomitant-medications/,,,7/30/2020,No recommendation,,,,,Don't unless clinical trial,https://infectioncontrol.ucsfmedicalcenter.org/sites/g/files/tkssra4681/f/Executive_Summary_UCSF_Adult_COVID_Inpatient_Management_Guidelines.pdff,,,Last updated 3/24/21. ,Don't,https://bwh.covidprotocols.org/protocols/therapeutics/#angiotensin-converting-enzyme-inhibitors-ace-i-and-angiotensin-ii-receptor-blockers-arbb,,,5/10/20:  BWH recommends against initiating ACEi/ARBs for the potential treatment of COVID-19,No recommendation,,,Anzics no rec,No recommendation,,,No recommendation,,,,,,No recommendation,,,,,,,,,,,No recommendation,,,
Publish,ACE inhibitor - Stopping chronic therapy on admission for COVID19,COVID-19 patients already on an ACEi or ARB for cardiovascular disease should continue these medications in the absence of other contraindications. ,Effect of Discontinuing vs Continuing ACEi & ARB for COVID-19 inpatients (JAMA Jan 2021),https://pubmed.ncbi.nlm.nih.gov/33464336/,Renin–Angiotensin–Aldosterone System Inhibitors and Risk of Covid-19 (NEJM June 2020),https://www.nejm.org/doi/full/10.1056/NEJMoa2008975,Articles & Tutorials,,,,,,,,,,,B,https://airtable.com/shrotaa0TOXrHFFsk/tbl2bwt3ywyTqJUlA?filter_Topic=RAAS%20Inhibitors,COVID19 Therapeutics,,,Don't,https://www.who.int/news-room/commentaries/detail/covid-19-and-the-use-of-angiotensin-converting-enzyme-inhibitors-and-receptor-blockers,,1/12/23: There is low-certainty evidence that patients on long-term therapy with ACE inhibitors or ARBs are not at higher risk of poor outcomes from COVID-19.  ,,No recommendation,,,,No recommendation,No recommendation,,,,No recommendation,No recommendation,,No recommendation,Don't,https://www.covid19treatmentguidelines.nih.gov/concomitant-medications/,,,"12/16/2021: Patients with COVID-19 who are receiving concomitant medications (e.g., angiotensin-converting enzyme [ACE] inhibitors, angiotensin receptor blockers [ARBs], HMG-CoA reductase inhibitors [statins], systemic or inhaled corticosteroids, nonsteroidal anti-inflammatory drugs, acid-suppressive therapy) for underlying medical conditions should not discontinue these medications during acute management of COVID-19 unless discontinuation is otherwise warranted by their clinical condition ",Inconclusive,https://www.idsociety.org/practice-guideline/covid-19-guideline-treatment-and-management/#toc-13,,,"Last updated September 4, 2020  ",Don't,https://infectioncontrol.ucsfmedicalcenter.org/sites/g/files/tkssra4681/f/Executive_Summary_UCSF_Adult_COVID_Inpatient_Management_Guidelines.pdf,,,"Theoretical concerns have been raised as some RAS blockers may increase expression of ACE2, which may facilitate viral entry into cells. However, currently there is not clinical or epidemiological data to support this concern. Patients who routinely take ACE inhibitors or ARB medications should generally continue these medications. ",Don't,https://bwh.covidprotocols.org/protocols/therapeutics/#angiotensin-converting-enzyme-inhibitors-ace-i-and-angiotensin-ii-receptor-blockers-arb,,,5/10/2020,Don't,https://www.nicd.ac.za/wp-content/uploads/2020/08/3-Mx-of-the-patient-with-asymptomatic-or-mild-disease.pdf,Aug 1 2020. ,Anzics do https://app.magicapp.org/#/guideline/L4Q5An/section/jWDvvL,No recommendation,,,No recommendation,,,,,,Don't,https://covidprotocols.org/chapters/treatments/#raas-inhibitors-t81x9z51xnjr,5/10/2020,,,,,,,,,No recommendation,,,
Publish,NSAID discontinuation,Guidelines to not recommend discontinuing or holding NSAIDs as antipyretic or analgesic therapy in patients with COVID-19 unless there are known contraindications for use of NSAIDs in individual patients.,,,,,,,,,,,,,,,,C,https://airtable.com/shrotaa0TOXrHFFsk/tbl2bwt3ywyTqJUlA?filter_Topic=NSAIDs,COVID19 Therapeutics,,,Don't,https://www.who.int/publications/i/item/WHO-2019-nCoV-clinical-2021-1,,"Last Updated Jan 25, 2021
 ",,Inconclusive,https://www.cdc.gov/coronavirus/2019-ncov/hcp/faq.html,,,11/12/2020,No recommendation,https://journals.lww.com/ccmjournal/Abstract/9000/Surviving_Sepsis_Campaign_Guidelines_on_the.95371.aspx,,,"Last updated January 28, 2021. While SCCM/ESICM Surviving Sepsis Campaign Guidelines on COVID19 do not address use of NSAIDs, antipyretic therapy with acetaminophen is specifically recommended over no treatment. ",No recommendation,https://journals.lww.com/ccmjournal/Abstract/9000/Surviving_Sepsis_Campaign_Guidelines_on_the.95371.aspx,"Last updated January 28, 2021. While SCCM/ESICM Surviving Sepsis Campaign Guidelines on COVID19 do not address use of NSAIDs, antipyretic therapy with acetaminophen is specifically recommended over no treatment. ",Don't,https://www.covid19treatmentguidelines.nih.gov/concomitant-medications/,,,4/21/21: Persons with COVID-19 who are taking NSAIDs for a comorbid condition should continue therapy as previously directed by their physician.,Inconclusive,https://www.idsociety.org/practice-guideline/covid-19-guideline-treatment-and-management/#toc-13,,,9/4/2020,Don't,https://infectioncontrol.ucsfmedicalcenter.org/sites/g/files/tkssra4681/f/Executive_Summary_UCSF_Adult_COVID_Inpatient_Management_Guidelines.pdf,,,Last updated 3/24/21. ,Don't,https://bwh.covidprotocols.org/protocols/therapeutics/#non-steroidal-anti-inflammatory-drugs-nsaids,,,5/10/2020,Don't,https://www.nicd.ac.za/wp-content/uploads/2020/08/3-Mx-of-the-patient-with-asymptomatic-or-mild-disease.pdf,Aug 1 2020. ,Anzics no rec,No recommendation,,,No recommendation,,,,,,No recommendation,,,,,,,,,,,No recommendation,,,
Publish,NSAID use if clinically appropriate,Current evidence does not suggest any specific harm of NSAID use in patients with COVID-19 for antipyrexia or pain control. Most guidelines recommend that NSAIDs may be used if clinically appropriate and not otherwise contraindicated.,,,,,,,,,,,,,,,,C,https://airtable.com/shrotaa0TOXrHFFsk/tbl2bwt3ywyTqJUlA?filter_Topic=NSAIDs,COVID19 Therapeutics,,,No recommendation,,,,,No recommendation,https://www.cdc.gov/coronavirus/2019-ncov/hcp/faq.html,,,"September 26, 2022: CDC is currently not aware of scientific evidence establishing a link between NSAIDs (e.g., ibuprofen, naproxen) and worsening of COVID‑19. FDA, the European Medicines Agency, the World Health Organization, and CDC are continuing to monitor the situation and will review new information on the effects of NSAIDs and COVID-19 disease as it becomes available. For those who wish to use treatment options other than NSAIDs, there are other over-the-counter and prescription medications approved for pain relief and fever reduction. Patients who rely on NSAIDs to treat chronic conditions and have additional questions should speak to their healthcare provider for individualized management. Patients should use NSAIDs, and all medications, according to the product labels and advice of their healthcare professional.",No recommendation,https://journals.lww.com/ccmjournal/Abstract/9000/Surviving_Sepsis_Campaign_Guidelines_on_the.95371.aspx,,,"Last updated January 28, 2021. While SCCM/ESICM Surviving Sepsis Campaign Guidelines on COVID19 do not address use of NSAIDs, antipyretic therapy with acetaminophen is specifically recommended over no treatment. ",No recommendation,https://journals.lww.com/ccmjournal/Abstract/9000/Surviving_Sepsis_Campaign_Guidelines_on_the.95371.aspx,"Last updated January 28, 2021. While SCCM/ESICM Surviving Sepsis Campaign Guidelines on COVID19 do not address use of NSAIDs, antipyretic therapy with acetaminophen is specifically recommended over no treatment. ",Do,https://www.covid19treatmentguidelines.nih.gov/concomitant-medications/,,,4/21/21  : Patients COVID-19 who are taking NSAIDs chronically may continue to take these medications if appropriate.,Inconclusive,https://www.idsociety.org/practice-guideline/covid-19-guideline-treatment-and-management/#toc-13,,,9/4/2020,Do,https://infectioncontrol.ucsfmedicalcenter.org/sites/g/files/tkssra4681/f/Executive_Summary_UCSF_Adult_COVID_Inpatient_Management_Guidelines.pdf,,,Last updated 3/24/21. ,Do,https://bwh.covidprotocols.org/protocols/therapeutics/#non-steroidal-anti-inflammatory-drugs-nsaids,,,Last updated May 2020: Initial concerns about NSAIDs worsening COVID-19 disease have not been clinically proven to date.,Do,https://www.nicd.ac.za/wp-content/uploads/2020/08/3-Mx-of-the-patient-with-asymptomatic-or-mild-disease.pdf,"Last updated August 2020: Paracetamol (acetaminophen) is recommended as first-line therapy for fever in COVID-19, but NSAIDs are not contraindicated.",,No recommendation,,,No recommendation,,,,,,Inconclusive,https://covidprotocols.org/chapters/treatments/#non-steroidal-anti-inflammatory-drugs-nsaids-9kczkakmsx6q,5/10/2020. Initial concerns about NSAIDs worsening COVID-19 disease have NOT been clinically proven,,,,,,,,,No recommendation,,,
Publish,Famotidine,There are inadequate data to recommend use of the H2-blocker famotidine as an antiviral therapy among patients with COVID-19.,,,,,,,,,,,,,,,,C,https://airtable.com/shrotaa0TOXrHFFsk/tbl2bwt3ywyTqJUlA?filter_Topic=Famotidine,COVID19 Therapeutics,,,No recommendation,,,No recommendation,,No recommendation,,,,No recommendation,No recommendation,,,,No recommendation,No recommendation,,No recommendation,Don't unless clinical trial,https://www.covid19treatmentguidelines.nih.gov/concomitant-medications/,,,4/21/2021,Don't,https://www.idsociety.org/COVID19guidelines#toc-0,,,5/10/2022. IDSA recommends against the use of famotidine for treatment of COVID-19 in hospitalized and nonhospitalized patients. ,Don't unless clinical trial,https://infectioncontrol.ucsfmedicalcenter.org/sites/g/files/tkssra4681/f/Executive_Summary_UCSF_Adult_COVID_Inpatient_Management_Guidelines.pdf,,,Last updated 3/24/21. UCSF recommends that any experimental therapy not specifically addressed by ts guidelines should only be used in the context of a clinical trial.,Don't,https://bwh.covidprotocols.org/protocols/therapeutics/#famotidine,,,"11/10/2021: BWH does not recommend routine use of famotidine for the treatment or prevention of COVID-19, but it still may still be warranted for other indications in patients with COVID-19, such as gastroesophageal reflux disease (GERD) or stress ulcer prophylaxis",No recommendation,,,"BWH unless otherwise indicated, but not for COVID (this section is in progress)",No recommendation,,,No recommendation,,,,,,No recommendation,,,,,,,,,,,No recommendation,,,
Publish,Colchicine,"Colchicine, a medication that inhibits many different inflammatory pathways via disruption of microtubule formation, has garnered interest as a potential therapeutic option for patients with COVID-19. However, randomized clinical trial data has not supported its efficacy and guidelines do not recommend its routine use.","
Colchicine in patients admitted to hospital with COVID-19 (RECOVERY): a randomised, controlled, open-label, platform trial (Lancet, Oct 2021)",https://www.sciencedirect.com/science/article/pii/S2213260021004355,"
Colchicine for community-treated patients with COVID-19 (COLCORONA): a phase 3, randomised, double-blinded, adaptive, placebo-controlled, multicentre trial (Lancet, 2021)",https://www.thelancet.com/journals/lanres/article/PIIS2213-2600(21)00222-8/fulltext,Articles & Tutorials,,,,,,,,,,,A,,COVID19 Therapeutics,,,Don't,https://app.magicapp.org/#/guideline/nBkO1E/section/EgaVdG,,"Jan 12, 2023: WHO strongly recommends against the use of colchicine in patients with COVID-19 who have non-severe illness. WHO does not make a recommendation for use of colchicine in severe or critical COVID-19. ",,No recommendation,,,,,No recommendation,,,,,No recommendation,,,Don't,https://www.covid19treatmentguidelines.nih.gov/therapies/immunomodulators/colchicine/,,,"5/31/22. NIH recommends against the use of colchicine among hospitalized patients. For non-hospitalized patients, NIH recommends against colchicine except in the context of a clinical trial. ",Don't,https://www.idsociety.org/practice-guideline/covid-19-guideline-treatment-and-management/,,,7/7/22. IDSA recommends against the use of colchicine for inpatients and outpatients. ,Don't unless clinical trial,https://infectioncontrol.ucsfmedicalcenter.org/sites/g/files/tkssra4681/f/Executive_Summary_UCSF_Adult_COVID_Inpatient_Management_Guidelines.pdf,,,11/17/22 UCSF recommends that any experimental therapy not specifically addressed by ts guidelines should only be used in the context of a clinical trial.,No recommendation,,,,,Inconclusive,https://www.nicd.ac.za/wp-content/uploads/2020/08/5-Drug-therapy-003.pdf,Aug 1 2020. NICD guidelines note that caution is advised regarding use of colchicine for COVID-19 until appropriate evidence is available. ,,No recommendation,,,No recommendation,,,,,,,,,,,,,,,,,No recommendation,,,
Publish,Inhaled corticosteroids,"The use of inhaled corticosteroids, such as budesonide or ciclesonide, has been explored as a treatment to prevent progression of disease in non-hospitalized patients with mild-moderate COVID-19. So far, results are mixed on the efficacy of this treatment at preventing hospitalization or improving symptoms. As a result, most organizations do not address or are inconclusive regarding inhaled corticosteroids. ","
Efficacy of Inhaled Ciclesonide for Outpatient Treatment of Adolescents and Adults With Symptomatic COVID-19 A Randomized Clinical Trial (JAMA Int. Med, Nov 2021)",https://jamanetwork.com/journals/jamainternalmedicine/fullarticle/2786012,"
Inhaled budesonide for COVID-19 in people at high risk of complications in the community in the UK (PRINCIPLE): a randomised, controlled, open-label, adaptive platform trial (The Lancet, Sept 2021)",https://www.thelancet.com/journals/lancet/article/PIIS0140-6736(21)01744-X/fulltext,Articles & Tutorials,"Inhaled budesonide in the treatment of early COVID-19 (STOIC): a phase 2, open-label, randomised controlled trial (The Lancet, April 2021)",https://www.thelancet.com/journals/lanres/article/PIIS2213-2600(21)00160-0/fulltext,Articles & Tutorials,,,,,,,,B,https://airtable.com/shrotaa0TOXrHFFsk/tbl2bwt3ywyTqJUlA?filter_Topic=Inhaled%20Corticosteroids,,,,No recommendation,,,,,No recommendation,,,,,No recommendation,,,,,No recommendation,,,Inconclusive,https://www.covid19treatmentguidelines.nih.gov/therapies/immunomodulators/corticosteroids/,,,12/16/21. The NIH does not recommend either for or against the use of inhaled corticosteroids for the treatment of COVID-19 due to insufficient data.,Don't,https://www.idsociety.org/practice-guideline/covid-19-guideline-treatment-and-management/#toc-9,,,31/8/2022. IDSA recommends against inhaled corticosteroids among non-hospitalized patients with mild-moderate COVID-19. Patients who are on inhaled corticosteroids for other indications may continue them.,Don't unless clinical trial,https://infectioncontrol.ucsfmedicalcenter.org/sites/g/files/tkssra4681/f/Executive_Summary_UCSF_Adult_COVID_Inpatient_Management_Guidelines.pdf,,,4/3/22. UCSF recommends that any experimental therapy not specifically addressed by ts guidelines should only be used in the context of a clinical trial.,Don't unless clinical trial,https://bwh.covidprotocols.org/protocols/therapeutics/#inhaled-corticosteroids,,,"1/16/22: BWH does not routiney recommend using inhaled corticosteroids for COVID-19 unless as part of a clinical trial. Inhaled corticosteroids may still be warranted for other indications in patients with COVID-19, such as asthma or COPD",,,,,No recommendation,,,No recommendation,,,,,,,,,,,,,,,,,No recommendation,,,
