Publish,Remdesivir in critically-ill COVID19 patients (on ventilator),"Guidelines on the use of Remdesivir are mixed. The ACTT-1 trial revealed improved time to recovery with Remdesivir, but another large RCT (SOLIDARITY, funded by WHO) found that Remdesivir did not improve mortality. Current guidelines stratify recommended use of Remdesivir based on illness severity and the Dashboard has broken this category into 2 topics: Remdesivir for patients requiring supplemental oxygen but not mechanically ventilated (severely ill), and Remdesivir for patients who are mechanically ventilated (critically ill).",Remdesivir for the Treatment of Covid-19 (NEJM 2020),https://www.nejm.org/doi/full/10.1056/NEJMoa2007764,Remdesivir and three other drugs for hospitalised patients with COVID-19: final results of the WHO Solidarity randomised trial and updated meta-analyses (Lancet May 2022),https://www.thelancet.com/journals/lancet/article/PIIS0140-6736(22)00519-0/fulltext,Articles & Tutorials,Remdesivir for the treatment of patients in hospital with COVID-19 in Canada: a randomized controlled trial (CMAJ Jan 2022),https://www.cmaj.ca/content/early/2022/01/19/cmaj.211698,Articles & Tutorials,Repurposed Antiviral Drugs for Covid-19 (NEJM Dec 2020),https://www.nejm.org/doi/full/10.1056/NEJMoa2023184,Articles & Tutorials,Patient Selection and Dosing,https://covidprotocols.org/en/chapters/treatments/#dosing-ttfesvkw6tr2,URL,,A,https://airtable.com/shrotaa0TOXrHFFsk/tbl2bwt3ywyTqJUlA?filter_Topic=Remdesivir,COVID19 Therapeutics,,,Don't,https://www.bmj.com/content/370/bmj.m3379,,"Last Updated January 13, 2023. WHO conditionally recommends against use of remdesivir for critical COVID-19 due to little or no effect on mortality, need for mechanical ventilation and uncertain effect on time to symptom improvement. ",,No recommendation,,,,No recommendation,Don't,https://journals.lww.com/ccmjournal/Abstract/9000/Surviving_Sepsis_Campaign_Guidelines_on_the.95371.aspx,,,"Last updated January 28, 2021. Remdesivir is not recommended for patients with COVID-19 who are intubated and mechanically ventilated.",Don't,https://journals.lww.com/ccmjournal/Abstract/9000/Surviving_Sepsis_Campaign_Guidelines_on_the.95371.aspx,"Last updated January 28, 2021. Remdesivir is not recommended for patients with COVID-19 who are not mechanically ventilated.",Don't,https://www.covid19treatmentguidelines.nih.gov/therapeutic-management/,,,Last updated 8/8/22 : Remdesivir is not recommended for patients undergoing mechanical ventilation due to lack of evidence of efficacy in this group.,Don't,https://www.idsociety.org/practice-guideline/covid-19-guideline-treatment-and-management/#toc-11,,,"Last updated 2/7/22  : In patients with COVID-19 on invasive ventilation and/or ECMO, the IDSA panel suggests against the routine initiation of remdesivir.",Do,https://infectioncontrol.ucsfmedicalcenter.org/sites/g/files/tkssra4681/f/Executive_Summary_UCSF_Adult_COVID_Inpatient_Management_Guidelines.pdf,,,Last updated 11/17/22: Recommended for inpatients with critical COVID-19 who are undergoing mechanical ventilation  or extracorporeal membrane oxygenation. ,Don't,https://bwh.covidprotocols.org/protocols/therapeutics/#remdesivir,,,Last updated Jan 14 2022: Remdesivir is not recommended for patients undergoing mechanical ventilation.,Don't unless clinical trial,https://www.nicd.ac.za/wp-content/uploads/2020/08/5-Drug-therapy-003.pdf,"Last updated Aug 1, 2020: Due to high costs and potentially marginal benefits, NICD does not recommend use of remdesivir outside of a clinical trial.","It's hard to encapsulate the complexity of all the studies on Remdesevir with one sentinel article. NIH recommends use of remdesivir in hospitalized patients on supplemental oxygen but not on HFNC, NIPPV, mechnically ventilated or receiving ECMO.",Don't unless clinical trial,https://app.magicapp.org/#/guideline/L4Qb5n/section/ERYAXn,"1/27/22. Remdesivir should not be used in patients who require high flow nasal oxygen, noninvasive positive pressure ventilation, or mechanical ventilation, except as a part of a clinical trial. ",Don't,,,,1/5/2023: AIIMS does not recommend remdesivir for those who are undergoing mechanical ventilation or on ECMO.,COVID Therapeutics,Do,https://covidprotocols.org/chapters/treatments/#remdesivir,"11/24/20. Recommended for patients with hypoxia, defined as SpO2 < 95% on room air, who do not require intubation. ",,,,,,,,,No recommendation,https://www.apollohospitals.com/apollo_pdf/Final-Redbook-External-circulation.pdf,,
Publish,Remdesivir in non-hospitalized patients,"Remdesivir, an intravenous, non-COVID specific antiviral medication, has been recommended for certain patients with severe or critical COVID-19 since late 2019. A recent clinical trial investigated the use of remdesivir in outpatients with mild-moderate COVID-19 who are at high risk for progression to severe COVID-19. The trial, which was sponsored by remdesivir's maker, found that a 3-day course of IV remdesivir in the outpatient setting resulted in an 87% lower risk of hospitalization or death from COVID-19 when compared to placebo. ",Early Remdesivir to Prevent Progression to Severe Covid-19 in Outpatients (NEJM Dec 2021),https://www.nejm.org/doi/full/10.1056/NEJMoa2116846,Patient Selection and Dosing,https://covidprotocols.org/en/chapters/treatments/#dosing-ttfesvkw6tr2,URL,,,,,,,,,,,B,,,,,Do,https://app.magicapp.org/#/guideline/nBkO1E/section/EPNzem,,"1/13/23. WHO conditionally recommends outpatient remdesivir for 3 days among patients with non-severe COVID-19 who are at highest risk of hospitalization. WHO notes that ""nirmatrelvir-ritonavir represents a superior choice because it may have greater efficacy in preventing hospitalization than the alternatives, has fewer concerns with respect to harms than does molnupiravir; and is easier to administer than intravenous remdesivir and [neutralizing monoclonal] antibodies.""",,Do,https://www.cdc.gov/coronavirus/2019-ncov/hcp/clinical-care/outpatient-treatment-overview.html,,,"January 31, 2023: The antiviral drug remdesivir (Veklury) is a preferred treatment for eligible adult and pediatric patients who are at high risk for progression to severe COVID-19. A 3-day course of intravenous remdesivir initiated within 7 days of symptom onset is the second preferred treatment option after Paxlovid for adults and pediatric patients (age >28 days and weight > 3kg).",,,,,,,,,Do,https://www.covid19treatmentguidelines.nih.gov/therapies/statement-on-therapies-for-high-risk-nonhospitalized-patients/,,,"8/18/22. NIH has issued combined guidance for the use of nirmatrelvir-ritonavir, remdesivir, certain monoclonal antibodies, and molnupiravir for non-hospitalized patients with mild-moderate COVID and high risk for progression to severe disease. NIH recommends the following drugs for these patients, in order of preference: Nirmatrelvir-ritonavir orally twice daily for 5 days within 5 days of symptom onset or remdesivir IV for 3 days; or, ONLY if neither of these preferred options are available or feasible to deliver: Bebtelovimab 175mg once as a single injection within 7 days of symptom onset or molnupiravir 800mg BID for 5 days within 5 days of symptom onset. The NIH also notes that without definitive data, clinicians could consider longer courses of nirmatrelvir/ritonavir or remdesivir in people who are immunocompromised who are symptomatic with evidence of ongoing SARS-CoV-2 replication. NIH specifies that care must be taken to avoid drug-drug interactions when using nirmatrelvir-ritonavir. See link for details. ",Do,https://www.idsociety.org/practice-guideline/covid-19-guideline-treatment-and-management/,,,"Feb 8, 2023: ""Among ambulatory patients with mild to moderate COVID-19 at
high risk for progression to severe disease, the IDSA guideline panel suggests remdesivir
initiated within seven days of symptom onset rather than no remdesivir.""",Do,https://infectioncontrol.ucsfmedicalcenter.org/sites/g/files/tkssra4681/f/UCSF%20COVID%20outpatient%20treatment%20guideline.pdf,,,"2/6/23: UCSF has issued combined guidance for use of 3 therapies for mild-moderate COVID in non-hospitalized patients with high risk of disease progression: IV remdesivir, nirmatrelvir-ritonavir (Paxlovid), and molnupiravir. Nirmatrelvir-ritonavir is considered first line therapy, IV remdesivir for 3 days is second line, and molnupiravir is considered third line. Due to limited availability of these medications, UCSF has recommended a tiered approach to dispensing these medications according to degree of underlying immunocompromise and risk factors for progression to severe disease, including age and level of vaccination (older and incompletely vaccinated persons are prioritized). See link for more details. ",Do,https://bwh.covidprotocols.org/protocols/therapeutics/#remdesivir,,,"Last updated January 14, 2022: A 3 day course of remdesivir is recommended for outpatients with COVID-19 disease and risk factors for progression within 7 days of symptom onset, if the drug is available and it is clinically feasible to deliver it. ",,,,,No recommendation,,,Don't,,,,1/5/2023: AIIMS does not suggest the use of remdesivir for those who are not at high risk of disease progression (requiring supplemental oxygen).,,,,,,,,,,,,,,,,
Publish,Steroids (systemic corticosteroids),"Guidelines and available data recommend the use of dexamethasone or an alternative equivalent corticosteroid for most patients hospitalized for COVID-19 who require supplemental oxygen, including those who are mechanically ventilated.

Multiple high-quality clinical trials have shown that a 5-10 day course of 6-20mg dexamethasone (or equivalent corticosteroid) reduces mortality in patients with COVID-19 who require supplemental oxygen, including those who are mechanically ventilated. Accordingly, all major guidelines currently recommend this practice. Guidelines and available evidence do not support the use of doses higher than 20mg dexamethasone (or equivalent) per day or recurrent courses of systemic steroids for progressive or resistant critical COVID-19. Some guidelines advise against use of dexamethasone in patients hospitalized for COVID-19 who have very low supplemental oxygen requirements; hover over individual recommendations for details. ",Effect of 12 mg vs 6 mg of Dexamethasone on the Number of Days Alive Without Life Support in Adults With COVID-19 and Severe Hypoxemia: The COVID STEROID 2 Randomized Trial (JAMA Oct 2021),https://jamanetwork.com/journals/jama/fullarticle/2785529,Administration of Systemic Corticosteroids in Patients With COVID-19 (JAMA Sept 2020),https://jamanetwork.com/journals/jama/fullarticle/2770279,Articles & Tutorials,Recovery Trial: Dexamethasone in Hospitalized Patients with Covid-19 — Preliminary Report (NEJM July 2020),https://www.nejm.org/doi/full/10.1056/NEJMoa2021436,Articles & Tutorials,Patient Selection and Dosing,https://covidprotocols.org/en/chapters/treatments/#dosing-ttfesvkw6tr2,URL,,,,,A,https://airtable.com/shrotaa0TOXrHFFsk/tbl2bwt3ywyTqJUlA?filter_Topic=Systemic%20Corticosteroids,Therapeutics in COVID-19,,,Do,https://www.bmj.com/content/370/bmj.m3379,,"1/13/2023 (LO) WHO recommends 6mg dexamethasone daily for up to a 10 day course for hospitalized patients with severe (who need supplemental oxygen) or critical (need oxygen and life support measures, or have ARDS) COVID-19. WHO recommends against corticosteroid therapy in patients with non-severe COVID-19. ",,No recommendation,https://emergency.cdc.gov/han/2022/pdf/CDC_HAN_463.pdf,,,"April 25, 2022: Systemic corticosteroids are recommended for hospitalized patients with COVID-19 who require supplemental oxygen or higher-level respiratory support.",Do,https://journals.lww.com/ccmjournal/Abstract/9000/Surviving_Sepsis_Campaign_Guidelines_on_the.95371.aspx,,,"Last updated January 28, 2021. Patients with severe or critical COVID-19 should receive a short course of systemic steroids. Dexamethasone, at a dose of 6mg per day for up to 10 days, is preferred over other corticosteroids.",Do,https://journals.lww.com/ccmjournal/Abstract/9000/Surviving_Sepsis_Campaign_Guidelines_on_the.95371.aspx,"Last updated January 28, 2021. Patients with severe or critical COVID-19 should receive a short course of systemic steroids. Dexamethasone, at a dose of 6mg per day for up to 10 days, is preferred over other corticosteroids.",Do,https://www.covid19treatmentguidelines.nih.gov/therapeutic-management/,,,"Last updated 8/8/21: NIH recommends administration of 6mg dexamethasone daily for 10 days or until hospital discharge in most patients hospitalized for COVID-19 who require supplemental oxygen, with the exception of those who require ""minimal"" conventional supplemental oxygen. For patients on dexamethasone who have rapidly increasing conventional oxygen needs and systemic inflammation, NIH recommends the addition a second immunomodulatory drug such as tocilizumab or baricitinib. Similarly, if a patient requires oxygen by HFNC, noninvasive ventilation, or invasive mechanical ventilation, the patient should receive baricitinib, tocilizumab, or sarilumab in addition to dexamethasone. Dexamethasone should not be used in patients with COVID-19 who do not require supplemental oxygen, including non-hospitalized patients. ",Do,https://www.idsociety.org/covid-19-real-time-learning-network/therapeutics-and-interventions/corticosteroids/,,,"Last updated Oct 28 2021  : IDSA guidelines recommend use of 6mg dexamethasone daily for 10 days or until hospital discharge among hospitalized patients with severe COVID-19 (defined as patients with SpO2 ≤94% on room air, or patients who require supplemental oxygen, mechanical ventilation or extracorporeal mechanical oxygenation). The IDSA suggests against the routine use of dexamethasone among patients who do not require supplemental oxygen. ",Do,https://infectioncontrol.ucsfmedicalcenter.org/sites/g/files/tkssra4681/f/Executive_Summary_UCSF_Adult_COVID_Inpatient_Management_Guidelines.pdf,,,"11/17/22: UCSF recommends dexamethasone 6mg daily for 10 days or until hospital discharge in patients with severe or critical COVID-19 illness. Patients who are not receiving supplemental oxygen, or who are only receiving 1-2L/min O2 and do not have evidence of a worsening clinical trajectory should not receive steroids. ",Do,https://bwh.covidprotocols.org/protocols/therapeutics/#systemic-corticosteroids,,,Last updated 11/8/21: 6mg dexamethasone daily for 10 days is recommended for patients who require supplemental O2 or are critically ill.,Do,https://www.nicd.ac.za/wp-content/uploads/2020/08/5-Drug-therapy-003.pdf,"Last updated Aug 1, 2020: 6mg dexamethasone daily for 10 days is recommended for patients receiving supplemental oxygen, including those receiving mechanical ventilation.",anzics do (pts receiving O2) https://app.magicapp.org/#/guideline/L4Q5An/section/L0OPkj. BWH does if receiving 02,Do,https://app.magicapp.org/#/guideline/L4Qb5n/section/n3e9gj,1/27/22. Dexamethasone should be given to hospitalized patients who require supplemental oxygen. Dexamethasone should be given for 10 days or until hospital discharge. Patients who do not require supplemental oxygen should not be given dexamethasone. ,Do, ,,,"1/5/2023: Systemic corticosteroids are not indicated in mild disease. However, for patients admitted to the ICU, the recommended dose should be dexamethasone 6 mg/day or equivalent dose of methylprednisolone (32 mg in 4 divided doses) usually for 5 to 10 days or until discharge, whichever is earlier. No evidence for benefit in higher doses.).",,Do,https://covidprotocols.org/chapters/treatments/#corticosteroids-avc48ggfj52,10/19/20. Recommended for patients who require supplemental O2 or are critically ill.,,,,,,,,,Do,https://www.apollohospitals.com/apollo_pdf/Final-Redbook-External-circulation.pdf,4/2021. Apollo recommends dexamethasone 8mg IV or PO daily for 7-10 days or until discharge. Alternatives regimens include hydrocortisone 50 mg IV q8h or methylprednisolone 32 mg/day. If Apollo guidelines further recommend consideration of a single dose of ivermectin 12mg PO to prevent Strongyloides hyper-infection.,
Publish,Convalescent plasma -- Hospitalized patients,"Most randomized clinical trials have not shown a benefit of convalescent plasma (from prior survivors of COVID-19 infection) in patients hospitalized with moderate to severe COVID-19. The titer of anti-SARS-CoV2 antibodies in units of convalescent plasma may play a role in its success or failure as a therapy, and ongoing trials are largely focused only on high-titer convalescent plasma. Most guidelines currently recommend against use of convalescent plasma for hospitalized patients outside of clinical trials, and some explicitly recommend against convalescent plasma in certain populations. Some guidelines specify that convalescent plasma collected prior to the emergence of the Omicron variant should not be used in any circumstances, given that it is unclear that such a product has any neutralizing activity against the Omicron Variant. ","Convalescent plasma in patients admitted to hospital with COVID-19 (RECOVERY): a randomised controlled, open-label, platform trial",https://www.thelancet.com/journals/lancet/article/PIIS0140-6736(21)00897-7/fulltext,A Randomized Trial of Convalescent Plasma in Covid-19 Severe Pneumonia (NEJM Nov 2020),https://opencriticalcare.org/covid-dashboard/#:~:text=A%20Randomized%20Trial%20of%20Convalescent%20Plasma%20in%20Covid%2D19%20Severe%20Pneumonia%20(NEJM%20Nov%202020),Articles & Tutorials,Association of Convalescent Plasma Treatment With Clinical Outcomes in Patients With COVID-19 A Systematic Review and Meta-analysis (JAMA 2021),https://jamanetwork.com/journals/jama/fullarticle/2777060,Articles & Tutorials,,,,,,,,A,https://airtable.com/shrotaa0TOXrHFFsk/tbl2bwt3ywyTqJUlA?filter_Topic=Convalescent%20Plasma,COVID19 Therapeutics,,,Don't unless clinical trial,https://app.magicapp.org/#/guideline/nBkO1E/rec/EeB5Mp,,"January 13, 2023: WHO recommends against use of convalescent plasma for severe COVID-19 outside of clinical trials. 
",,No recommendation,,,,No recommendation,Don't unless clinical trial,https://journals.lww.com/ccmjournal/Abstract/9000/Surviving_Sepsis_Campaign_Guidelines_on_the.95371.aspx,,,"Last updated January 28, 2021. Patients with severe or critical COVID-19 should not received convalescent plasma outside of the setting of a clinical trial. ",,,,Don't,https://www.covid19treatmentguidelines.nih.gov/anti-sars-cov-2-antibody-products/convalescent-plasma/,,,"12/1/22: NIH makes 3 recommendations regarding the use of convalescent plasma:
1. Recommends against the use of any convalescent plasma collected prior to the emergence of the Omicron Variant; 
2. Recommends against the use of convalescent plasma for the treatment of COVID-19 among hospitalized patients without impaired humoral immunity. 
3. Does not recommend for or against the use of convalescent plasma collected after the emergence of the Omicron variant among hospitalized patients who have impaired humoral immunity.
",Don't,https://www.idsociety.org/practice-guideline/covid-19-guideline-treatment-and-management/#toc-11,,,June 26 2023: IDSA recommends against the use of convalescent plasma in patients hospitalized with COVID-19 including immunocompromised patients. IDSA notes that this is a strong recommendation with moderate certainty of evidence.,Don't unless clinical trial,https://infectioncontrol.ucsfmedicalcenter.org/sites/g/files/tkssra4681/f/Executive_Summary_UCSF_Adult_COVID_Inpatient_Management_Guidelines.pdf,,,"Last updated 11/17/22: UCSF notes that convalescent plasma generally should not be used outside of a clinical trial, but may be considered in severely immunosuppressed patients not expected to mount a robust immune response.",Don't,https://bwh.covidprotocols.org/protocols/therapeutics/#convalescent-plasma,,,"Last updated Aug 19, 2021: BWH notes that convalescent plasma is generally not recommended for treatment of COVID-19.",Don't unless clinical trial,https://www.nicd.ac.za/wp-content/uploads/2020/08/5-Drug-therapy-003.pdf,"Last updated Aug 1, 2020. ",BWH is case by case. Anzics don't https://covid19evidence.net.au/#living-guidelines,No rec,,1/27/2022,Don't,,,,1/5/2023: The most recent AIIMS/ICMR guideline does not recommend convalescent plasma for any patients with COVID-19. ,,Don't unless clinical trial,https://covidprotocols.org/chapters/treatments/#convalescent-plasma-zhl41h7gyr17,11/15/2020,,,,,,,,,Inconclusive ,https://www.apollohospitals.com/apollo_pdf/Final-Redbook-External-circulation.pdf,"4/2021. Apollo guidelines suggest consideration of high-titer convalescent plasma for high risk patients (defined as "">75 y or >65y with co-morbidities"") who present within 3 days of symptom onset. Illness severity is not specified in the guidelines and use of convalescent plasma is labelled an ""experimental therapy.""",
Publish,Convalescent plasma -- Non-hospitalized patients,"2/9/22. Convalescent plasma has been investigated as a potential therapy for outpatients with mild-moderate COVID-19. So far, data is mixed, and as such, guidelines are currently inconclusive, with some institutions against, and some suggesting that plasma may be used if other outpatient therapies are not available. Some guidelines specify that convalescent plasma collected prior to the emergence of the Omicron variant should not be used in any circumstances, given that it is unclear that such a product has any neutralizing activity against the Omicron Variant. ",Early Convalescent Plasma for High-Risk Outpatients with Covid-19 (NEJM Nov 2021),https://www.nejm.org/doi/full/10.1056/NEJMoa2103784,Early High-Titer Plasma Therapy to Prevent Severe Covid-19 in Older Adults (NEJM Jan 2021),https://pubmed.ncbi.nlm.nih.gov/33406353/,Articles & Tutorials,,,,,,,,,,,A,,,,,Don't,https://app.magicapp.org/#/guideline/nBkO1E/section/nJB6MR,,"January 13, 2023: WHO strongly recommends against use of convalescent plasma in patients with non-severe COVID-19.",,,,,,,,,,,,,,,Inconclusive,https://www.covid19treatmentguidelines.nih.gov/anti-sars-cov-2-antibody-products/convalescent-plasma/,,7/21/2023,"
In ambulatory patients with or without impaired humoral immunity, NIH does not recommend for or against the use of convalescent plasma due to insufficient data. NIH recommends against the use of any convalescent plasma collected prior to the emergence of the omicron variant for any reason, given uncertainty about its ability to neutralize the omicron variant. Without definitive data, some patients who are immunocompromised with prolonged symptoms of COVID-19 and evidence of ongoing SARS-CoV-2 replcation could consider high-titer COVID-19 convalescent plasma. ",Do,https://www.idsociety.org/globalassets/idsa/practice-guidelines/covid-19/treatment/idsa-covid-19-gl-tx-and-mgmt---convalescent-plasma-2022-02-03.pdf,,,"Feb 8 2022. Among ambulatory patients with mild to moderate COVID-19 at high risk for progression to severe disease who have no other treatment options, the IDSA guideline panel suggests FDA-qualified high-titer COVID-19 convalescent plasma within 8 days of symptom onset rather than no high-titer COVID-19 convalescent plasma. IDSA notes that this is a conditional recommendation with low certainty of evidence.",No recommendation,,,,,Don't,https://bwh.covidprotocols.org/protocols/therapeutics/#convalescent-plasma,,,"Last updated Aug 19, 2021: BWH notes that convalescent plasma is generally not recommended for treatment of COVID-19.",,,,,No rec,,1/27/2022,Don't,,,,1/5/2023: The most recent AIIMS/ICMR guideline does not recommend convalescent plasma for any patients with COVID-19. ,,,,,,,,,,,,,,,,
