Entry status,"Topic item
TITLE
ENGLISH","Summary Statement/STEM 
(~2 sentences)",Link to high impact primary data 1 - label,Link to high impact primary data 1 - URL,Link to high impact primary data 2 - label,Link to high impact primary data 2 - URL,Link to high impact primary data 2 - icon,Link to high impact primary data 3 - label,Link to high impact primary data 3- URL,Link to high impact primary data 3 - icon,Link to high impact primary data 4 - label,Link to high impact primary data 4- URL,Link to high impact primary data 4 - icon,Link to high impact primary data 5 - label,Link to high impact primary data 5- URL,Link to high impact primary data 5 - icon,COVID specific data available?,Level of Evidence,Link to covidprotocols lit review,"Topic Tag 1
 ","Topic Tag 2
","Topic Tag 3
",WHO,Link to rec,Link custom label,Date last updated,Content ENGLISH,CDC,Link to rec ,Link custom label,Date last updated,Content ENGLISH,SCCM,Link to rec  ,Link custom link,Date last updated,Content ENGLISH,Johns Hopkins,JHU link to rec,(Date last updated by JHU),NIH,Link to rec ,Link custom label,Date last updated,Content ENGLISH,IDSA,Link to rec,Link custom label,Date last updated,Content ENGLISH,UCSF,Link to rec,Link custom label,Date last updated,Content ENGLISH,BWH,Link to rec,Link custom label,Date last updated,Content ENGLISH,South Africa NICD,LINK TO NICD REC,DATE LAST UPDATED AND NOTES ,Other notes,UK NICE,Link,Date updated and notes,AIIMS,Link to rec,Link custom label,Date last updated,Content ENGLISH,,COVIDprotocols V2.0,LINK TO CP.org v2.0,DATE LAST UPDATED AND NOTES TO PUBLISH,AAP,,,,,,,,Apollo hospitals,Link,Date updated and notes,Spanish
publication-status,title-en,description-en,additional-link-1-label,additional-link-1-url,additional-link-2-label,additional-link-2-url,additional-link-2-icon,additional-link-3-label,additional-link-3-url,additional-link-3-icon,additional-link-4-label,additional-link-4-url,additional-link-4-icon,additional-link-5-label,additional-link-5-url,additional-link-5-icon,,level,,topic-tag-1,topic-tag-2,topic-tag-3,who-decision,who-link,who-link-label,who-date-updated,who-content-en,cdc-decision,cdc-link,cdc-link-label,cdc-date-updated,cdc-content-en,sccm-decision,sccm-link,sccm-link-label,sccm-date-updated,sccm-content-en,,,,nih-decision,nih-link,nih-link-label,nih-date-updated,nih-content-en,idsa-decision,idsa-link,idsa-link-label,idsa-date-updated,idsa-content-en,ucsf-decision,ucsf-link,ucsf-link-label,ucsf-date-updated,ucsf-content-en,bwh-decision,bwh-link,bwh-link-label,bwh-date-updated,bwh-content-en,,,,,,,,aiims-decision,aiims-link,aiims-link-label,aiims-date-updated,aiims-content-en,,,,,,,,,,,,,,,,
Publish,High Flow Nasal Oxygen,"High Flow Nasal Oxygen/Cannula (HFNO/HFNC) may be used to maintain SpO2 >90-94% in patients with hypoxemic respiratory failure who otherwise do not meet criteria for intubation and have escalating conventional oxygen requirements. HFNO/HFNC is considered an Aerosol Generating Procedure by many organizations; appropriate PPE and precautions should be used. The recent RECOVERY-RS trial studied HFNO in comparison to conventional nasal oxygen and CPAP, and found that CPAP, but not  HFNO, reduced need for intubation compared to conventional oxygen therapy. ",HFNC in Acute Hypoxemic Respiratory Failure (NEJM 2015),https://www.nejm.org/doi/full/10.1056/nejmoa1503326,Association of Noninvasive Oxygenation Strategies With All-Cause Mortality in Adults With Acute Hypoxemic Respiratory Failure (JAMA 2020)                                                        ,https://jamanetwork.com/journals/jama/fullarticle/2767025 (2020),,,,,,,,,,,,C,https://airtable.com/shrotaa0TOXrHFFsk/tbl2bwt3ywyTqJUlA?filter_Topic=High%20Flow%20Nasal%20Cannula,Inpatient,,,Do,https://app.magicapp.org/#/guideline/j1WBYn/section/L6mKwA,,23.06.2022,"In hospitalized patients with severe or critical COVID-19 and acute hypoxaemic respiratory failure not needing emergent intubation, WHO suggests high-flow nasal oxygen (HFNO) rather than standard oxygen therapy. WHO does not make a recommendation regarding high flow nasal oxygen versus noninvasive ventilation or continuous positive pressure ventilation due to lack of data comparing these modalities. ",No recommendation,https://www.cdc.gov/coronavirus/2019-ncov/hcp/therapeutic-options.html,,,No recommendation,Do,https://journals.lww.com/ccmjournal/Abstract/9000/Surviving_Sepsis_Campaign_Guidelines_on_the.95371.aspx,,28.01.2021,,Do,https://journals.lww.com/ccmjournal/Abstract/9000/Surviving_Sepsis_Campaign_Guidelines_on_the.95371.aspx,Last Updated January 28 2021. ,Do,https://www.covid19treatmentguidelines.nih.gov/critical-care/oxygenation-and-ventilation/,,17.12.2020,NIH recommends HFNC over NIPPV/CPAP for initial therapy for patients who are hypoxemic despite conventional oxygen therapy. ,No recommendation,,,16.09.2020,,Do,https://infectioncontrol.ucsfmedicalcenter.org/sites/g/files/tkssra4681/f/COVID-19%20Respiratory%20Management.pdf,,24.03.2021,,Do,https://bwh.covidprotocols.org/protocols/respiratory#h.ywa2doczx9oq,,09.03.2020,,Do,https://www.nicd.ac.za/wp-content/uploads/2020/08/4-Respiratory-support.pdf,8/1/2020,"BWH does for the same indiciations as anyone else, but typically not for ARDS management, more for rapidly reversible causes, though some COVID ARDS patients end up on it  ",Don't,https://app.magicapp.org/#/guideline/L4Qb5n/section/E5P5Jn,1/28/2022. UK NICE recommends against the routine use of HFNC as the main form of respiratory support for people with COVID-19 and respiratory failure in whom escalation to invasive mechanical ventilation would be appropriate.,Do,,,01.05.2023,"AIIMS recommends the use of high flow nasal oxygen for those who require increasing oxygen support with high disease severity. (This includes those those admitted to the HDU/ICU experiencing breathlessness, a respiratory rate of >30/ min, and/or SpO < 90% on room air.)",Spontaneously ventilating patients,Do,,12/20/2020,,,,,,,,,Do,https://www.apollohospitals.com/apollo_pdf/Final-Redbook-External-circulation.pdf,Apr-21,
Publish,Prone Positioning (Non-Intubated Patients),"Data for proning patients non-intubated patients is evolving although case series and limited pre-COVID studies suggest feasibility and possible benefit of ""awake"" proning combined with oxygen therapy in avoiding intubation. Patients who are self-proned require close monitoring including pulse oximetry, telemetry, and frequent clinical observation. ","Prone Positioning in Awake, Nonintubated Patients With COVID-19 Hypoxemic Respiratory Failure",https://jamanetwork.com/journals/jamainternalmedicine/article-abstract/2767575,"Awake prone positioning for COVID-19 acute hypoxaemic respiratory failure: a randomised, controlled, multinational, open-label meta-trial",https://www.thelancet.com/journals/lanres/article/PIIS2213-2600(21)00356-8/fulltext,Online Course,,,,,,,,,,,B,https://airtable.com/shrotaa0TOXrHFFsk/tbl2bwt3ywyTqJUlA?filter_Topic=Self-proning,PPE,,,Do,https://app.magicapp.org/#/guideline/j1WBYn/rec/Lw7OXL,,12.01.2023,"Last Updated January 12, 2023 (though states still in review): ""We suggest awake prone positioning of severely ill patients hospitalized with COVID-19 requiring supplemental oxygen (includes high flow nasal oxygen) or non-invasive ventilation (conditional, low certainty evidence).""",No recommendation,https://www.cdc.gov/coronavirus/2019-ncov/hcp/therapeutic-options.html,,,No recommendation,Inconclusive,https://journals.lww.com/ccmjournal/Abstract/9000/Surviving_Sepsis_Campaign_Guidelines_on_the.95371.aspx,,28.01.2021,Last Updated January 28 2021.  The Surviving Sepsis COVID-19 Guidelines do not recommend for or against awake prone-positioning due to insufficient evidence.,Inconclusive,https://journals.lww.com/ccmjournal/Abstract/9000/Surviving_Sepsis_Campaign_Guidelines_on_the.95371.aspx,Last Updated January 28 2021.  The Surviving Sepsis COVID-19 Guidelines do not recommend for or against awake prone-positioning due to insufficient evidence.,Do,https://www.covid19treatmentguidelines.nih.gov/critical-care/oxygenation-and-ventilation/,,17.12.2020,"Last updated 12/17/20. NIH guidelines support awake proning, but note that it should not be used as ""rescue"" therapy for patients who otherwise have indications for intubation.",No recommendation,,,16.09.2020,,No recommendation,,,,,Do,https://bwh.covidprotocols.org/protocols/respiratory#h.b0od9kk71va1,,03.09.2020,Self-proning may be used on stable patients or as therapy for patients with escalating oxygen needs.,Do,https://www.nicd.ac.za/wp-content/uploads/2020/08/4-Respiratory-support.pdf,"Last updated August 1, 2020: Awake proning is recommended in patients able to self-prone who do not otherwise require intubation.",,No rec,,,Do,,,05.01.2023,AIIMS encourages awake pronation in all patients requiring supplemental oxygen therapy with sequential position changes every 2 hours.,,Do,,12/20/2020. Self-proning may be used on stable patients or as therapy for patients with escalating oxygen needs.,,,,,,,,,Do,https://www.apollohospitals.com/apollo_pdf/Final-Redbook-External-circulation.pdf,Apr-21,
Publish,Prone Positioning (Intubated Patients),"For mechanically ventilated patients with moderate to severe ARDS (P:F<150) despite optimized mechanical ventilation, prone positioning for 12-16 hours per day may improve outcomes. Continuous infusions of neuromuscular blockade are not always required. Guideline support for this therapy is largely based on its efficacy in trials on non-COVID hypoxemic respiratory failure.","
Prone Positioning in Severe ARDS (NEJM 2013)",https://www.nejm.org/doi/full/10.1056/nejmoa1214103,Prone Position for Acute Respiratory Distress Syndrome (ATS 2017),,Articles & Tutorials,,,,,,,,,,,C,https://airtable.com/shrotaa0TOXrHFFsk/tbl2bwt3ywyTqJUlA?filter_Topic=Proning,PPE,COVID19 Therapeutics,,Do,https://app.magicapp.org/#/guideline/j1WBYn/rec/Lw7OXL,,"Last Updated January 12, 2023 (though states still in review): ""We suggest awake prone positioning of severely ill patients hospitalized with COVID-19 requiring supplemental oxygen (includes high flow nasal oxygen) or non-invasive ventilation (conditional, low certainty evidence).""",,No recommendation,https://www.cdc.gov/coronavirus/2019-ncov/hcp/therapeutic-options.html,,,No recommendation,Do,https://journals.lww.com/ccmjournal/Abstract/9000/Surviving_Sepsis_Campaign_Guidelines_on_the.95371.aspx,,,"Last updated January 28, 2021",Do,https://journals.lww.com/ccmjournal/Abstract/9000/Surviving_Sepsis_Campaign_Guidelines_on_the.95371.aspx,"Last updated January 28, 2021",Do,https://www.covid19treatmentguidelines.nih.gov/critical-care/oxygenation-and-ventilation/,,,Last updated 12/17/20,No recommendation,,,,9/16/2020,Do,https://infectioncontrol.ucsfmedicalcenter.org/sites/g/files/tkssra4681/f/Executive_Summary_UCSF_Adult_COVID_Inpatient_Management_Guidelines.pdf,,,Last updated 3/24/21,Do,https://bwh.covidprotocols.org/protocols/respiratory/#refractory-hypoxemia,,,"Last updated September 5, 2020: Early proning is recommended when P:F < 150 or FiO2 > 60% to improve oxygenation. ",Do,https://www.nicd.ac.za/wp-content/uploads/2020/08/4-Respiratory-support.pdf,"Last updated Aug 1, 2020: Application of prone ventilation 12-16 hours a day is strongly recommended for patients with severe ARDS",,No Rec,,,Do,,,,1/5/2023: AIIMS encourages awake pronation in all patients requiring supplemental oxygen therapy with sequential position changes every 2 hours.,,Do,https://covidprotocols.org/chapters/critical-care-management/#prone-ventilation-a13nnrvj16iz,12/20/2020. Early proning in COVID-associated ARDS requires intensive management but can significantly improve oxygenation.,,,,,,,,,Do,https://www.apollohospitals.com/apollo_pdf/Final-Redbook-External-circulation.pdf,"4/2021. In patients with severe ARDS, prone ventilation for >12 hours per day is recommended. ",
Publish,"Non-invasive Positive Pressure Ventilation (aka NIPPV, NIV, CPAP)","In adults with acute hypoxemic respiratory failure, a trial of CPAP or NIPPV/BiPAP may be considered if mechanical ventilation is not indicated. Risks include delayed intubation and some experts believe NIPPV/BiPAP in patients with ARDS can cause direct pulmonary injury.  Airborne precautions should be utilized. The RECOVERY-RS trial studied HFNO and CPAP in comparison to conventional nasal oxygen , and found that CPAP, but not HFNO, reduced need for intubation compared to conventional oxygen therapy. ",Effect of Noninvasive Respiratory Strategies on Intubation or Mortality Among Patients With Acute Hypoxemic Respiratory Failure and COVID-19: The RECOVERY-RS Randomized Clinical Trial (JAMA Jan 2022),https://jamanetwork.com/journals/jama/fullarticle/2788505,Association of Noninvasive Oxygenation Strategies With All-Cause Mortality in Adults With Acute Hypoxemic Respiratory Failure,https://jamanetwork.com/journals/jama/fullarticle/2767025,Articles & Tutorials,HFNC in Acute Hypoxemic Respiratory Failure (NEJM 2015),https://www.nejm.org/doi/full/10.1056/nejmoa1503326,Articles & Tutorials,,,,,,,,C,https://airtable.com/shrotaa0TOXrHFFsk/tbl2bwt3ywyTqJUlA?filter_Topic=CPAP%2FBIPAP,Outpatient,,,Do,https://app.magicapp.org/#/guideline/j1WBYn/section/L6mKwA,,12.01.2023,"January 12, 2023: In hospitalized patients with severe or critical COVID-19 and hypoxemic respiratory failure not needing emergent intubation, WHO suggests high-flow nasal oxygen, non-invasive ventilation, or continuous positive pressure ventilation, rather than standard oxygen therapy. WHO does not make a recommendation regarding high flow nasal oxygen versus noninvasive ventilation or continuous positive pressure ventilation due to lack of data comparing these modalities. ",No recommendation,,,,No recommendation,Do,https://journals.lww.com/ccmjournal/Abstract/9000/Surviving_Sepsis_Campaign_Guidelines_on_the.95371.aspx,,28.01.2021,"SCCM/ESICM guidelines suggest HFNC as first line therapy for hypoxemia refractory to conventional oxygen; if HFNC is unavailable, a trial of NIV may be appropriate if there are no indications for urgent intubation.",Do,https://journals.lww.com/ccmjournal/Abstract/9000/Surviving_Sepsis_Campaign_Guidelines_on_the.95371.aspx,"Last Updated January 28 2021. SCCM/ESICM guidelines suggest HFNC as first line therapy for hypoxemia refractory to conventional oxygen; if HFNC is unavailable, a trial of NIV may be appropriate if there are no indications for urgent intubation.",Do,https://www.covid19treatmentguidelines.nih.gov/critical-care/oxygenation-and-ventilation/,,17.12.2020,Last updated 12/17/20. A trial of NIPPV is recommended for hypoxemia refractory to conventional oxygen therapy if HFNC is not available and there is no current indication for intubation.,No recommendation,,,,,Inconclusive,https://infectioncontrol.ucsfmedicalcenter.org/sites/g/files/tkssra4681/f/Executive_Summary_UCSF_Adult_COVID_Inpatient_Management_Guidelines.pdf,,,"UCSF suggests that NIPPV may be considered in acute respiratory failure in patients with COVID-19, but notes that this is a weak recommendation due to limitations of existing data. NIPPV should be used if there is a concurrent established indication for NIPPV, such as COPD exacerbation or OSA. ",Inconclusive,https://bwh.covidprotocols.org/protocols/respiratory#h.obd3f4pqya35,,02.09.2020,"NIPPV may be considered for patients with COVID-19 and concurrent known indications for NIPPV, such as OSA, COPD flare, or heart failure. NIPPV should generally be avoided in the same situations that NIPPV is avoided in patients without COVID-19. ",Do,https://www.nicd.ac.za/wp-content/uploads/2020/08/4-Respiratory-support.pdf,"Last updated August 2020: In the absence of an indication for endotracheal intubation, a trial of high-flow nasal oxygen (HFNO), continuous positive airway pressure (CPAP) or other non-invasive ventilation (NIV) technique may be
considered for adults with COVID-19 and acute hypoxaemic respiratory failure failing standard oxygen therapy",BWH like HFNC this depends on the indication. We allow it in COVID patients but typically isnt an alternative to ventilation,Do,https://app.magicapp.org/#/guideline/L4Qb5n/section/E5P5Jn,"NICE guidelines conditionally recommend consideration of continuous positive airway pressure (CPAP) to people with COVID-19 when they have hypoxaemia that is not responding to supplemental oxygen with a fraction of inspired oxygen of 0.4 (40%) or more and escalation to invasive mechanical ventilation would be an option but it is not immediately needed, or it is agreed that respiratory support should not be escalated beyond CPAP.",Do,,,05.01.2023,"NIV by helmet or face mask may be considered in patients with increasing oxygen requirement and *low* work of breathing. (This includes those those admitted to the HDU/ICU experiencing breathlessness, a respiratory rate of >30/ min, and/or SpO < 90% on room air.)",,Do,,"12/20/2020. NIPPV may considered for patients with COVID-19 and concurrent known indications for NIPPV, such as OSA, COPD flare, or heart failure. A trial of NIPPV may be offered for patients with escalating oxygen requirements when HFNC or intubation/mechanical ventilation is not available. ",,,,,,,,,Do,https://www.apollohospitals.com/apollo_pdf/Final-Redbook-External-circulation.pdf,"4/2021. Patients receiving a trial of NIV should be in a
monitored setting and cared for by experienced
personnel capable of endotracheal intubation in
case the patient acutely deteriorates or does not
improve after a short trial (about 1 hr). Patients with
hemodynamic instability, multiorgan failure, or
abnormal mental status should not receive NIV.",
Publish,Protocolized lung protective ventilation for COVID-19 ARDS,"Lung protective ventilation should be pursued for all ARDS patients undergoing mechanical ventilation. This includes targeting tidal volumes of 4-6mL/kg Ideal Body Weight, targeting Plateau Pressure < 30cmH2O, and titrating FiO2 and PEEP per ARDSnet protocols. Available guidelines do not support deviation from existing ARDS ventilation protocols in the care of COVID-19 patients.",English – Respiratory Care Pocket Card v2022.1,https://opencriticalcare.org/respiratory-care-card/,Protective ventilation and outcomes of critically ill patients with COVID-19: a cohort study (Annals of Int Med 2021),https://annalsofintensivecare.springeropen.com/articles/10.1186/s13613-021-00882-w,Articles & Tutorials,Ventilation with Lower Tidal Volumes as Compared with Traditional Tidal Volumes for Acute Lung Injury and the Acute Respiratory Distress Syndrome (NEJM May 2000),https://www.nejm.org/doi/full/10.1056/nejm200005043421801,Articles & Tutorials,,,,,,,,C,https://airtable.com/shrotaa0TOXrHFFsk/tbl2bwt3ywyTqJUlA?filter_Topic=Ventilator%20Settings,Management of hypoxemia,Therapeutics in COVID-19,,Do,,,"Last Updated Jan 25, 2021
 ",,No recommendation,,,,,Do,https://journals.lww.com/ccmjournal/Abstract/9000/Surviving_Sepsis_Campaign_Guidelines_on_the.95371.aspx,,,"Last updated January 28, 2021",Do,https://journals.lww.com/ccmjournal/Abstract/9000/Surviving_Sepsis_Campaign_Guidelines_on_the.95371.aspx,"Last updated January 28, 2021",Do,https://www.covid19treatmentguidelines.nih.gov/critical-care/oxygenation-and-ventilation/,,,Last updated 12/17/20,No recommendation,,,,,Do,https://infectioncontrol.ucsfmedicalcenter.org/sites/g/files/tkssra4681/f/Executive_Summary_UCSF_Adult_COVID_Inpatient_Management_Guidelines.pdf,,,Last updated 3/24/21,Do,https://bwh.covidprotocols.org/protocols/respiratory/#initial-mechanical-ventilation,,,9/3/2020,Do,https://www.nicd.ac.za/wp-content/uploads/2020/08/4-Respiratory-support.pdf,8/1/2020,,No rec,,,Do,,,,"1/5/2023: For those admitted to the ICU, AIIMS recommends use of institutional protocol for ventilatory management when required.",Mechanically ventilated patients,Do,https://covidprotocols.org/chapters/critical-care-management/#lung-protective-ventilation-83nvm2s0ckc,12/20/2020,,,,,,,,,Do,https://www.apollohospitals.com/apollo_pdf/Final-Redbook-External-circulation.pdf,4/2021. Apollo guidelines allow for up to 8cc/kg IBW tidal volumes. ,
