Publish,Vaccine Booster,"The protection from coronavirus vaccines decreases over time and against newer COVID-19 variants such as Omicron. Vaccine ""boosters,""  help to ensure ongoing immune response against COVID-19 and its variants. Many global authorities now recommend booster shots to complete a primary series for most adults and some children. The selection, timing, and dosing of ""booster"" vaccines varies based on the type of vaccine used for the primary series, availability, country, and local guidance. Bivalent boosters include protection against the ancestral strain and Omicron subvariants depending on the region and are now the recommended booster for adults and some children who have completed their primary series or previously received monovalent booster.  Available data suggests that booster doses improve immunity and protect against bad outcomes.  ",Bivalent Omicron BA.1–Adapted BNT162b2 Booster in Adults Older than 55 Years (NEJM Jan 2023),https://www.nejm.org/doi/full/10.1056/NEJMoa2213082?query=featured_coronavirus,A Bivalent Omicron-Containing Booster Vaccine against Covid-19 (NEJM Oct 2022),https://www.nejm.org/doi/full/10.1056/NEJMoa2208343?query=featured_coronavirus,Apps and calculators,BNT162b2 Vaccine Booster and Mortality Due to Covid-19 (NEJM Dec 2021),https://www.nejm.org/doi/full/10.1056/NEJMoa2115624,Articles & Tutorials,Randomized Trial of a Third Dose of mRNA-1273 Vaccine in Transplant Recipients (NEJM Aug 2021),https://www.nejm.org/doi/full/10.1056/NEJMc2111462,Articles & Tutorials,Antibody Response After a Third Dose of the mRNA-1273 SARS-CoV-2 Vaccine in Kidney Transplant Recipients With Minimal Serologic Response to 2 Doses (JAMA Jul 2021),https://jamanetwork.com/journals/jama/fullarticle/2782538,Articles & Tutorials,,B,,,,,Do,https://www.who.int/news/item/17-05-2022-interim-statement-on-the-use-of-additional-booster-doses-of-emergency-use-listed-mrna-vaccines-against-covid-19,,"May 17,2022 (LO) WHO recommends that moderately and severely immunocompromised persons should be offered an additional dose of all WHO EUL COVID-19 vaccines as part of an extended primary
series since these individuals are less likely to respond adequately to vaccination following a standard primary vaccine series and are at high risk of severe COVID-19 disease.  WHO does not specify the exact definition of moderate or severe immunocompromise. WHO further recommends that all persons age 60 and older who received the Sinovac or Sinopharm vaccines be offered a third dose as part of an extended primary series. ",,Do,https://www.cdc.gov/coronavirus/2019-ncov/vaccines/booster-shot.html,,,"January 25, 2023: The US CDC recommends that people ages 5 years or older to receive 1 bivalent mRNA vaccine dose, also known as a ""booster"" dose, 2 months after completing monovalent primary series or previously received monovalent booster dose(s). The CDC also recommends boosters for children aged 6 months–4 years who completed the Moderna primary series and if it has been at least 2 months since their last dose.",,,,,,,,,Do,https://www.covid19treatmentguidelines.nih.gov/overview/prevention-of-sars-cov-2/,,,Oct. 19 2021. The NIH agrees with CDC recommendations for vaccine boosters. ,No recommendation,https://www.idsociety.org/covid-19-real-time-learning-network/vaccines/vaccine-dosing--schedule/#Booster,,,"Jan 27, 2023: The IDSA summarizes available data on vaccine boosters in COVID-19 patients but does not make a specific recommendation.",Do,https://www.ucsfhealth.org/covid/vaccine,,,"April 1, 2022. UCSF recommends that those who have received an initial primary series of any SARS-CoV2 vaccine receive a booster dose of an mRNA vaccine. Moderately to severely immunocompromised patients aged 12 and older are recommended to complete an extended primary series by receiving a 3rd dose, and then a 4th ""booster"" dose at least 4 months after their most recent dose. UCSF notes that adults age 50 and up who are not immunocompromised may also choose to receive a 4th ""booster"" dose at least 5 months after their most recent dose. ",Do,https://bwh.covidprotocols.org/protocols/ambulatory-management/#vaccination,,,"March 2 2022. All eligible adolescents and adults age 12 and older should receive a 3rd ""booster"" dose of an mRNA vaccine, or a 2nd ""booster"" dose if they initially received the Johnson and Johnson vaccine. Immunocompromised patients should complete a 3-dose primary series and receive an mRNA vaccine booster at least 3 months after their most recent dose. ",,,,,,,,No recommendation,,,,,,,,,,,,,,,,,,,,
Publish,Vaccination in children and adolescents,"While every major global public health organization recommends vaccination for adults, some organizations remain hesitant to recommend vaccination in children due to less available data and lower risk of COVID-19 to infected children. We anticipate guidance will change as complete efficacy and safety data for various vaccines in children become available, and adequate supplies of vaccines are available. Please note that some organizations have different recommendations for children under age 11-12 and children age 12 and older (""adolescents""). Which vaccines are approved for use and are being used varies by country; for example, in the United States and England, the Pfizer vaccine is currently approved for children and adolescents; in India, the ZyCov-D vaccine has been approved for adolescents but a vaccination program has not yet been rolled out. ","
Evaluation of mRNA-1273 Vaccine in Children 6 Months to 5 Years of Age (NEJM Nov 2022)
",https://www.nejm.org/doi/full/10.1056/NEJMoa2209367?query=featured_coronavirus,"
Effectiveness of COVID-19 Pfizer-BioNTech BNT162b2 mRNA Vaccination in Preventing COVID-19–Associated Emergency Department and Urgent Care Encounters and Hospitalizations Among Nonimmunocompromised Children and Adolescents Aged 5–17 Years — VISION Network, 10 States, April 2021–January 2022 (March, 2022)
",https://www.cdc.gov/mmwr/volumes/71/wr/mm7109e3.htm,Articles & Tutorials,"
Evaluation of the BNT162b2 Covid-19 Vaccine in Children 5 to 11 Years of Age (NEJM Nov 2021)
",https://www.nejm.org/doi/full/10.1056/NEJMoa2116298,Articles & Tutorials,"
Safety, Immunogenicity, and Efficacy of the BNT162b2 Covid-19 Vaccine in Adolescents (NEJM Jul 2021)",https://www.nejm.org/doi/full/10.1056/NEJMoa2107456,Articles & Tutorials,,,,,,,,,,Inconclusive,https://www.who.int/news/item/11-08-2022-interim-statement-on-covid-19-vaccination-for-children,,"August 11, 2022. (LO) Per WHO: ""As children and adolescents tend to have milder disease compared to adults, unless they are in a group at higher risk of severe COVID-19, it is less urgent to vaccinate them than older people, those with chronic health conditions and health workers.""",,Do,https://www.cdc.gov/coronavirus/2019-ncov/vaccines/recommendations/children-teens.html?s_cid=11368:covid%20vaccine%20for%20children%20under%2016:sem.ga:p:RG:GM:gen:PTN:FY21,,,"January 25, 2023: The US CDC recommends that all children ages 6 months through 11 years old should be vaccinated against COVID-19 and only mRNA vaccines are authorized in these age groups. The timing and dosing of vaccination depends on age group (6 months-4 years vs. 5-11 years) and type of vaccine used. Children who are moderately or Severely Immunocompromised should also receive additional primary series doses depending on age group and type of vaccine originally used. Bivalent boosters are also authorized for children ages 5 years or older (depending on age) administered 2 months after completing primary series or monovalent booster dose. Note that Pfizer BioNTech bivalent booster is authorized for children ages 5 years or older while Moderna bivalent booster is only authorized for children ages 6 years or older. ",No recommendation,,,,,Do,https://www.hopkinsmedicine.org/health/conditions-and-diseases/coronavirus/covid19-vaccine-what-parents-need-to-know,11/26/21. Johns Hopkins Medicine encourages all families to have eligible children vaccinated with the COVID-19 vaccine.,Do,https://www.covid19treatmentguidelines.nih.gov/overview/prevention-of-sars-cov-2/,,,10/19/21. NIH recommends COVID-19 vaccination for everyone who is eligible according to the United States Advisory Committee on Immunization Practices. This includes children and adolescents. ,Do,https://www.idsociety.org/covid-19-real-time-learning-network/vaccines/vaccine-dosing--schedule/#Overview,,,"Jan 27, 2023: IDSA supports FDA and CDC decisions to authorize the Pfizer-BioNTech COVID-19 vaccine for children aged 6 months to 4 years, 5 to 11 years, and those 12 years and older. See link for recommended vaccine dose scheduling for children.",Do,https://www.ucsfbenioffchildrens.org/education/covid-19-vaccine,,,12/8/21. UCSF recommends vaccination of all eligible children. ,Do,https://www.massgeneralbrigham.org/covid19/vaccine/about#children,,,12/1/21: BWH recommends vaccination for all children who are eligible per CDC recommendations. ,,,,,,,,,,,,,,,,,,,,,,,,,,,,
Publish,N95 or equivalent for Healthcare Workers,"N95 or equivalent grade respirators (including powered respirators), as opposed to surgical/medical masks, should be used in addition to other PPE when performing Aerosol Generating Procedures (AGPs) in the care of COVID19 patients. Many health authorities also recommend that respirators be used in routine care for patients with COVID-19 if adequate supplies are available. ","
Risk of SARS-CoV-2 Acquisition in Health Care Workers According to Cumulative Patient Exposure and Preferred Mask Type (JAMA Netw Open Aug 2022)",https://jamanetwork.com/journals/jamanetworkopen/fullarticle/2795150,,,,,,,,,,,,,,C,https://airtable.com/shrotaa0TOXrHFFsk/tbl2bwt3ywyTqJUlA?filter_Topic=Masks,PPE/IPC,Management of hypoxemia,,Do,https://www.who.int/news-room/questions-and-answers/item/coronavirus-disease-covid-19-masks,,"01/13/ 2023 (LO). Particle respirators should be worn along with other PPE (gown, gloves and eye protection) by health workers performing aerosol-generating procedures (AGPs) and by health workers on duty in settings where AGPs are regularly performed on patients with suspected or confirmed COVID-19, such as intensive care units, semi-intensive care units or emergency departments. Respirators should also be worn in areas of poor ventilation. WHO also notes that respirator use in healthcare settings should also be based on health workers’ values and preferences and on their perception of what offers the highest protection possible to prevent SARS-CoV-2 infection.",,Do,https://www.cdc.gov/coronavirus/2019-ncov/hcp/infection-control-recommendations.html,,,"September 23, 2022: N95-grade respirators should be worn by healthcare workers caring for patients with COVID-19 who are undergoing AGPs. Facilities in counties with substantial or high transmission may consider implementing universal use of NIOSH-approved N95 or equivalent or higher-level respirators for healthcare workers during all patient care encounters or in specific units or areas of the facility at higher risk for SARS-CoV-2 transmission.",Do,https://journals.lww.com/ccmjournal/Abstract/9000/Surviving_Sepsis_Campaign_Guidelines_on_the.95371.aspx,,,Last updated January 28 2021,Do,https://journals.lww.com/ccmjournal/Abstract/9000/Surviving_Sepsis_Campaign_Guidelines_on_the.95371.aspx,Last updated January 28 2021,Do,https://www.covid19treatmentguidelines.nih.gov/critical-care/infection-control/,,,Oct-20,Do,https://www.idsociety.org/practice-guideline/covid-19-guideline-infection-prevention/,,,2/8/22. The IDSA guideline panel recommends that healthcare personnel caring for patients with suspected or known COVID-19 use either a medical/surgical mask or N95 (or N99 or PAPR) respirator compared with no mask. The IDSA guideline panel recommends that healthcare personnel involved with aerosol-generating procedures on suspected or known COVID-19 patients use an N95 (or N99 or PAPR) respirator instead of a medical/surgical mask.,Do,https://infectioncontrol.ucsfmedicalcenter.org/sites/g/files/tkssra4681/f/Guidance_for_PPE_use_for_High_Risk_Aerosol_Generating_Procedures.pdf,,,"1/28/22. UCSF mandates use of N95 for routine care of all patients with confirmed COVID-19, including during aerosol-generating procedures. UCSF ""strongly recommends"" that healthcare workers use N95 masks during all patient contacts, even with patients who have had a negative test for COVID-19. ",No recommendation,,,,,Do,https://www.nicd.ac.za/wp-content/uploads/2020/08/9-Infection-prevention-and-control.pdf,Aug 1 2020. ,,Do,https://www.apollohospitals.com/apollo_pdf/Final-Redbook-External-circulation.pdf,Apr-21,No recommendation,,,,,Infection prevention and Control (PPE),Do,https://covidprotocols.org/protocols/ambulatory-ed-and-floor-management#h.x4pxbrhfeoai,"9/24/2020. When supplies allow, an N95 or equivalent grade particulate respirator is recommended for AGPs even in patients not COVID-positive or suspected.",,,,,,,,,Do,https://www.apollohospitals.com/apollo_pdf/Final-Redbook-External-circulation.pdf,Apr-21,
Draft,Surgical/medical masks for routine care of patients with COVID-19,"Multiple guidelines suggest that the use medical/surgical masks provides adequate protection during routine care (that is, no AGPs are ordered or expected) of COVID19 patients, but many institutions encourage the use of respirators instead of medical/surgical masks at all times when providing direct care for COVID19 patients if adequate supplies of respirators are available. 
",,,,,,,,,,,,,,,,C,https://airtable.com/shrotaa0TOXrHFFsk/tbl2bwt3ywyTqJUlA?filter_Topic=Masks,PPE/IPC,,,Do,https://www.who.int/publications/i/item/advice-on-the-use-of-masks-in-the-community-during-home-care-and-in-healthcare-settings-in-the-context-of-the-novel-coronavirus-(2019-ncov)-outbreak,,"Last updated December 1, 2020  : Medical/surgical masks may be used in suspected/confirmed COVID-19 patient care settings where aerosol generating procedures are not performed, but N95/FFP2/FFP3 grade respirators are recommended in these settings if they are widely available and cost is not an issue.",,Do,https://www.cdc.gov/coronavirus/2019-ncov/hcp/infection-control-recommendations.html,,,"Last updated November 4, 2020: N95-grade respirators are preferred when taking care of any patient with confirmed or suspected COVID-19, but medical/surgical masks may be used if no AGPs are ordered or planned and supplies of N95-grade respirators are limited. ",Do,https://journals.lww.com/ccmjournal/Fulltext/2020/06000/Surviving_Sepsis_Campaign__Guidelines_on_the.29.aspx,,,"Last updated January 28, 2021: For healthcare workers providing usual care for nonventilated COVID19 patients or non-aerosol-generating procedures on mechanically ventilated (closed circuit) COVID-19 patients, SCCM/ESICM Surviving Sepsis Campaign Guidelines for COVID19 suggest using surgical/medical masks as opposed to respirator masks, in addition to other PPE (e.g., gloves, gown, and eye protection, such as a face shield or safety goggles).",Do,https://journals.lww.com/ccmjournal/Fulltext/2020/06000/Surviving_Sepsis_Campaign__Guidelines_on_the.29.aspx,"Last updated January 28, 2021: For healthcare workers providing usual care for nonventilated COVID19 patients or non-aerosol-generating procedures on mechanically ventilated (closed circuit) COVID-19 patients, SCCM/ESICM Surviving Sepsis Campaign Guidelines for COVID19 suggest using surgical/medical masks as opposed to respirator masks, in addition to other PPE (e.g., gloves, gown, and eye protection, such as a face shield or safety goggles).",Do,https://www.covid19treatmentguidelines.nih.gov/critical-care/infection-control/,,,Last updated October 2020: Healthcare workers providing usual care for non-ventilated COVID-19 patients may wear an N95-grade respirator or surgical mask.,Do,https://www.idsociety.org/covid-19-real-time-learning-network/infection-prevention/personal-protective-equipment-in-medical-settings/,,,10/24/2020,Don't,https://infectioncontrol.ucsfmedicalcenter.org/sites/g/files/tkssra4681/f/PPE%20Update.pdf,,,"Last updated August 5, 2020: UCSF recommends use of an N95-level respirator (rather than a surgical mask) and eye protection for all care of patients with COVID-19, even if no AGPs are ordered or planned.",Do,https://bwh.covidprotocols.org/protocols/ambulatory-ed-and-floor-management/#personal-protective-equipment-and-transport,,,"Last updated October 14, 2020: If adequate supplies are available, the use of an N95 or equivalent respirator is recommended for routine care of COVID-19 patients, even if no AGPs are ordered or planned.",Do,https://www.nicd.ac.za/wp-content/uploads/2020/08/9-Infection-prevention-and-control.pdf,Aug 1 2020. ,"BWH: In what context? Direct patient care for COVID + patients, or just around the hospital? For covid patients we do N95s always because people cough which is aerosolizing",Do,,,No recommendation,,,,,,Do,https://covidprotocols.org/chapters/personal-protective-equipment/#ppe-during-clinical-care-9fd7gtrx9mrp,9/24/2020,,,,,,,,,Do,,,
Publish,Wearing a mask in public,"Combined with other measures, masking is an important tool to decrease community transmission of the SARS-CoV2 virus. Masks should be well-fitting and comfortable, and worn over both the nose and mouth. Surgical masks may be more effective than cloth masks, and N95, KN95 or similar respirators are most effective to protect individuals from getting or spreading COVID-19.","
Effectiveness of public health measures in reducing the incidence of covid-19, SARS-CoV-2 transmission, and covid-19 mortality: systematic review and meta-analysis (BMJ Nov 2021)
",https://www.bmj.com/content/375/bmj-2021-068302,"
The Impact of Community Masking on COVID-19: A Cluster-Randomized Trial in Bangladesh (Inst. for Poverty Action, Aug 2021. Note: not peer-reviewed)
",https://www.poverty-action.org/publication/impact-community-masking-covid-19-cluster-randomized-trial-bangladesh,Articles & Tutorials,"
Maximizing Fit for Cloth & Medical Procedure Masks to Reduce SARS-CoV-2 Transmission & Exposure (CDC Feb 2021)",https://www.cdc.gov/mmwr/volumes/70/wr/mm7007e1.htm,Articles & Tutorials,,,,,,,,B,,Outpatient Care,PPE/IPC,,Do,https://www.who.int/emergencies/diseases/novel-coronavirus-2019/question-and-answers-hub/q-a-detail/coronavirus-disease-covid-19-masks,,"01/13/2023 (LO). In settings where there is community transmission of SARS-CoV-2, irrespective of vaccination status or history of prior infection, wearing a well-fitting mask that covers the nose and mouth is recommended for the public when interacting with individuals who are not members of their household in most indoor locations and outdoors if a distance of 1 meter cannot be maintained. ",,Inconclusive,https://www.cdc.gov/coronavirus/2019-ncov/prevent-getting-sick/about-face-coverings.html,,,"September 9, 2022 - CDC stratifies recommendations for public masking based on local levels of SARS-CoV2 transmission in various parts of the United States. In areas of low transmission, CDC recommends mask use based on personal preference and individual risk level. In areas of medium transmission, immunocompromised people or those that interact with immunocompromosed people should wear masks in public. In areas of high transmission, CDC recommends that all individuals wear a well-fitting mask indoors in public, regardless of vaccination status or individual risk. See the link for details. ",No recommendation,,,,,No recommendation,,,No recommendation,,,,,Do,https://www.idsociety.org/public-health/covid-19/masks/,,,"1/14/22. Per IDSA: ""Everyone should mask up in indoor public settings, and infected individuals who leave isolation after five days must continue to wear their mask around others.""",Do,https://safety.ucsf.edu/safe-distancing-resources,,,"July 15, 2021. UCSF maintains a universal masking system for all visitors and staff.",Do,July 2020?,,,BWH mandates universal masking for all employees and visitors while on BWH campuses. ,No recommendation,,,,No recommendation,,,No recommendation,,,,,,,,,,,,,,,,,No recommendation,,,
Publish,PCR testing (NAAT) for persons with suspected COVID-19,"All individuals with symptoms consistent with COVID-19 should undergo testing for SARS-CoV2 infection. PCR-based testing, also known as NAAT (Nucleic Acid Amplification Test), is considered the gold standard diagnostic test for COVID-19, although false negative results are possible.","
SARS-CoV-2 Viral Load in Upper Respiratory Specimens of Infected Patients (NEJM March 2020)",https://www.nejm.org/doi/full/10.1056/NEJMc2001737,,,,,,,,,,,,,,A,https://airtable.com/shrotaa0TOXrHFFsk/tbl2bwt3ywyTqJUlA?filter_Topic=PCR,PPE/IPC,,,Do,https://www.who.int/mongolia/multi-media/item/rt-pcr-test,,"Last Updated April 5, 2022",,Do,https://www.cdc.gov/coronavirus/2019-ncov/symptoms-testing/testing.html,,,"September 28, 2022: NAATs, such as PCR-based tests, are most often performed in a laboratory. They are typically the most reliable tests for people with or without symptoms. These tests detect viral genetic material, which may stay in your body for up to 90 days after you test positive. Therefore, you should not use a NAAT if you have tested positive in the last 90 days.",No recommendation,https://journals.lww.com/ccmjournal/Fulltext/2020/06000/Surviving_Sepsis_Campaign__Guidelines_on_the.29.aspx,,,"Last updated March 28, 2020: SCCM recommended testing lower respiratory tract samples for diagnosis of suspected COVID-19 in patients who are intubated; however, the most recent SCCm guidelines update (January 2021) does not specify any specific test",No recommendation,https://journals.lww.com/ccmjournal/Fulltext/2020/06000/Surviving_Sepsis_Campaign__Guidelines_on_the.29.aspx,"Last updated March 28, 2020: SCCM recommends testing lower respiratory tract samples with NAAT for diagnosis of suspected COVID-19 in patients who are intubated.",Do,https://www.covid19treatmentguidelines.nih.gov/overview/sars-cov-2-testing/,,,Last updated: 4/21/21,Do,https://www.idsociety.org/covid-19-real-time-learning-network/diagnostics/RT-pcr-testing/#Guidelines,,,"Last updated December 9, 2020: IDSA recommends NAAT for all individuals with high suspicion of symptomatic or asymptomatic SARS-CoV2 infection. ",Do,https://infectioncontrol.ucsfmedicalcenter.org/sites/g/files/tkssra4681/f/COVID-19_Testing_Guidance.pdf,,,"Last updated October 27, 2020",Do,https://bwh.covidprotocols.org/protocols/diagnostics/#sars-cov-2-testing,,,"Last updated December 5, 2020: The current standard of care for diagnostic testing for active COVID-19 is PCR testing. ",Do,https://www.nicd.ac.za/wp-content/uploads/2020/08/2-Testing-002.pdf,Last updated Aug 1 2020. PCR-based tests are recommended for the diagnosis of acute COVID-19 infection.,,Do,https://www.apollohospitals.com/apollo_pdf/Final-Redbook-External-circulation.pdf,Apr-21,No recommendation,,,,,,Do,https://covidprotocols.org/chapters/covid-testing/#testing-symptomatic-patients-5k0a1afuwuq5,12/19/20. The standard of care for diagnostic testing in symptomatic patients is PCR testing. ,,,,,,,,,Do,https://www.apollohospitals.com/apollo_pdf/Final-Redbook-External-circulation.pdf,Apr-21,
